### ISSUE TITLE
`git` can not clone with this stack

### ISSUE THREAD

**Issue by dinosaure** [roburio/utcp#16]
Currently on my experiment, I can not `git clone`, it seems that the unikernel is stuck on the `read`. The unikernel is the [`simple-store`][simple-store] available on a specific branch of `ocaml-git`. It requires:
- `mirage~my-tcp`
- A pin to this repository
- A pin to `ocaml-git~mirage-protocols.7.0.0+tcp`

Into a private local network (an usual `br0` + `tap0` on 192.168.1.2/24 and 192.168.1.3/24 (with `--ipv4-gateway=192.168.1.2`), I have this output from the unikernel:
```
2021-11-26 00:21:59 +01:00: DBG [happy-eyeballs.mirage] action 1 connect host.invalid (using 192.168.1.2:9418)
2021-11-26 00:21:59 +01:00: DBG [application] starting rexmt timer 1m04s (backoff is 1.000s)
2021-11-26 00:21:59 +01:00: DBG [tcp.user] 192.168.1.3:63347 -> 192.168.1.2:9418 active open TCP syn sent cb needfin false
shouldacknow false snd_una 2384549957 snd_max 2384549958 snd_nxt 2384549958
snd_wl1 0 snd_wl2 0 iss 2384549957 snd_wnd 0 snd_cwnd 1073725440
snd_sshtresh 1073725440 rcv_wnd 65535 tf_rxwin0sent false rcv_nxt 0 irs 0
rcv_adv 65535 snd_recover 0 t_maxseg 536 t_advmss 1460 snd_scale 0
rcv_scale 0 request_r_scale 6
tf_doing_ws false
2021-11-26 00:21:59 +01:00: DBG [happy-eyeballs] timer
2021-11-26 00:21:59 +01:00: DBG [happy-eyeballs] timer 0 actions
2021-11-26 00:21:59 +01:00: DBG [ipv4] ip write: mtu is 1500, hdr_len is 20, size 0 payload len 28, needed_bytes 48
2021-11-26 00:21:59 +01:00: INF [tcp.input] 192.168.1.3:63347 -> 192.168.1.2:9418 TCP S seq 2487698756
ack 2384549958 window 64240 opts window scale 7;
MSS 1460, 0 bytes data
2021-11-26 00:21:59 +01:00: DBG [tcp.input] 192.168.1.3:63347 -> 192.168.1.2:9418 handle_conn TCP syn sent cb needfin false
shouldacknow false snd_una 2384549957 snd_max 2384549958 snd_nxt 2384549958
snd_wl1 0 snd_wl2 0 iss 2384549957 snd_wnd 0 snd_cwnd 1073725440
snd_sshtresh 1073725440 rcv_wnd 65535 tf_rxwin0sent false rcv_nxt 0 irs 0
rcv_adv 65535 snd_recover 0 t_maxseg 536 t_advmss 1460 snd_scale 0
rcv_scale 0 request_r_scale 6 tf_doing_ws false seg S seq 2487698756
ack 2384549958 window 64240 opts window scale 7;
MSS 1460, 0 bytes data
2021-11-26 00:21:59 +01:00: DBG [tcp.input] 192.168.1.3:63347 -> 192.168.1.2:9418 now TCP established cb needfin false
shouldacknow false snd_una 2384549958 snd_max 2384549958 snd_nxt 2384549958
snd_wl1 2487698757 snd_wl2 2384549958 iss 2384549957 snd_wnd 0 snd_cwnd 4380
snd_sshtresh 1073725440 rcv_wnd 65535 tf_rxwin0sent false rcv_nxt 2487698757
irs 2487698756 rcv_adv 2487764229 snd_recover 0 t_maxseg 1460 t_advmss 1460
snd_scale 7 rcv_scale 6 request_r_scale 6
tf_doing_ws true
2021-11-26 00:21:59 +01:00: INF [tcp.input] answer  seq 2384549958 ack 2487698757 window 1023
opts , 0 bytes data
2021-11-26 00:21:59 +01:00: DBG [ipv4] ip write: mtu is 1500, hdr_len is 20, size 0 payload len 20, needed_bytes 40
2021-11-26 00:21:59 +01:00: DBG [happy-eyeballs] received event 1 connected to host.invalid (using 192.168.1.2:9418)
2021-11-26 00:21:59 +01:00: DBG [happy-eyeballs.mirage] connection ok to 192.168.1.2:9418 after 2.711ms
2021-11-26 00:21:59 +01:00: DBG [git-fetch] Start to verify the given stream.
2021-11-26 00:21:59 +01:00: DBG [git-cstruct-append] Make a new file-descriptor (false) (1 byte(s)).
2021-11-26 00:21:59 +01:00: DBG [thin] Start to analyse the PACK file.
2021-11-26 00:21:59 +01:00: DBG [git.sync] Load locals references.
2021-11-26 00:21:59 +01:00: DBG [git.mem] Ref.list.
2021-11-26 00:21:59 +01:00: DBG [smart_flow] Write 53 byte(s).
2021-11-26 00:21:59 +01:00: DBG [smart_flow] Start to read 65536 byte(s).
2021-11-26 00:21:59 +01:00: DBG [happy-eyeballs] timer
2021-11-26 00:21:59 +01:00: DBG [happy-eyeballs] timer 0 actions
2021-11-26 00:22:04 +01:00: DBG [ARP] replying to ARP request for 192.168.1.3 from 192.168.1.2 (mac ba:15:5a:0d:dd:6e)
2021-11-26 00:22:51 +01:00: DBG [ipv4] dropping IP fragment not for us or broadcast IPv4 packet 192.168.1.2 -> 224.0.0.251: id 3220, off 16384 proto 17, ttl 255, options 
2021-11-26 00:24:59 +01:00: DBG [ipv4] dropping IP fragment not for us or broadcast IPv4 packet 192.168.1.2 -> 224.0.0.251: id 6d9c, off 16384 proto 17, ttl 255, options 
```

A `tcpdump -i tap0 -X` gives me this output:
```
00:21:58.618273 IP6 :: > ip6-allrouters: ICMP6, router solicitation, length 8
	0x0000:  6000 0000 0008 3aff 0000 0000 0000 0000  `.....:.........
	0x0010:  0000 0000 0000 0000 ff02 0000 0000 0000  ................
	0x0020:  0000 0000 0000 0002 8500 7bb8 0000 0000  ..........{.....
00:21:58.618336 ARP, Request who-has 192.168.1.3 tell 192.168.1.3, length 28
	0x0000:  0001 0800 0604 0001 169b 7cc9 3672 c0a8  ..........|.6r..
	0x0010:  0103 0000 0000 0000 c0a8 0103            ............
00:21:58.618389 IP6 :: > ff02::1:ffc9:3672: ICMP6, neighbor solicitation, who has fe80::149b:7cff:fec9:3672, length 24
	0x0000:  6000 0000 0018 3aff 0000 0000 0000 0000  `.....:.........
	0x0010:  0000 0000 0000 0000 ff02 0000 0000 0000  ................
	0x0020:  0000 0001 ffc9 3672 8700 7e15 0000 0000  ......6r..~.....
	0x0030:  fe80 0000 0000 0000 149b 7cff fec9 3672  ..........|...6r
00:21:58.630448 IP6 bacon > ff02::16: HBH ICMP6, multicast listener report v2, 3 group record(s), length 68
	0x0000:  6000 0000 004c 0001 fe80 0000 0000 0000  `....L..........
	0x0010:  b815 5aff fe0d dd6e ff02 0000 0000 0000  ..Z....n........
	0x0020:  0000 0000 0000 0016 3a00 0502 0000 0100  ........:.......
	0x0030:  8f00 9d66 0000 0003 0400 0000 ff02 0000  ...f............
	0x0040:  0000 0000 0000 0000 0000 00fb 0400 0000  ................
	0x0050:  ff02 0000 0000 0000 0000 0001 ff0d dd6e  ...............n
	0x0060:  0400 0000 ff02 0000 0000 0000 0000 0000  ................
	0x0070:  0000 006a                                ...j
00:21:58.630464 IP6 bacon > ff02::16: HBH ICMP6, multicast listener report v2, 2 group record(s), length 48
	0x0000:  6000 0000 0038 0001 fe80 0000 0000 0000  `....8..........
	0x0010:  14dd b9ff fe08 d281 ff02 0000 0000 0000  ................
	0x0020:  0000 0000 0000 0016 3a00 0502 0000 0100  ........:.......
	0x0030:  8f00 fb04 0000 0002 0400 0000 ff02 0000  ................
	0x0040:  0000 0000 0000 0000 0000 00fb 0400 0000  ................
	0x0050:  ff02 0000 0000 0000 0000 0001 ff08 d281  ................
00:21:59.412997 IP6 bacon > ff02::16: HBH ICMP6, multicast listener report v2, 2 group record(s), length 48
	0x0000:  6000 0000 0038 0001 fe80 0000 0000 0000  `....8..........
	0x0010:  14dd b9ff fe08 d281 ff02 0000 0000 0000  ................
	0x0020:  0000 0000 0000 0016 3a00 0502 0000 0100  ........:.......
	0x0030:  8f00 fb04 0000 0002 0400 0000 ff02 0000  ................
	0x0040:  0000 0000 0000 0000 0000 00fb 0400 0000  ................
	0x0050:  ff02 0000 0000 0000 0000 0001 ff08 d281  ................
00:21:59.468351 IP6 bacon > ff02::16: HBH ICMP6, multicast listener report v2, 3 group record(s), length 68
	0x0000:  6000 0000 004c 0001 fe80 0000 0000 0000  `....L..........
	0x0010:  b815 5aff fe0d dd6e ff02 0000 0000 0000  ..Z....n........
	0x0020:  0000 0000 0000 0016 3a00 0502 0000 0100  ........:.......
	0x0030:  8f00 9d66 0000 0003 0400 0000 ff02 0000  ...f............
	0x0040:  0000 0000 0000 0000 0000 00fb 0400 0000  ................
	0x0050:  ff02 0000 0000 0000 0000 0001 ff0d dd6e  ...............n
	0x0060:  0400 0000 ff02 0000 0000 0000 0000 0000  ................
	0x0070:  0000 006a                                ...j
00:21:59.631788 ARP, Request who-has bacon (Broadcast) tell 192.168.1.3, length 28
	0x0000:  0001 0800 0604 0001 169b 7cc9 3672 c0a8  ..........|.6r..
	0x0010:  0103 ffff ffff ffff c0a8 0102            ............
00:21:59.631917 ARP, Reply bacon is-at ba:15:5a:0d:dd:6e (oui Unknown), length 28
	0x0000:  0001 0800 0604 0002 ba15 5a0d dd6e c0a8  ..........Z..n..
	0x0010:  0102 169b 7cc9 3672 c0a8 0103            ....|.6r....
00:21:59.632479 IP 192.168.1.3.63347 > bacon.git: Flags [S], seq 2384549957, win 65535, options [mss 1460,wscale 6,eol], length 0
	0x0000:  4500 0030 0000 0000 2606 1173 c0a8 0103  E..0....&..s....
	0x0010:  c0a8 0102 f773 24ca 8e21 5845 0000 0000  .....s$..!XE....
	0x0020:  7002 ffff f924 0000 0204 05b4 0303 0600  p....$..........
00:21:59.632574 IP bacon.git > 192.168.1.3.63347: Flags [S.], seq 2487698756, ack 2384549958, win 64240, options [mss 1460,nop,wscale 7], length 0
	0x0000:  4500 0030 0000 4000 4006 b772 c0a8 0102  E..0..@.@..r....
	0x0010:  c0a8 0103 24ca f773 9447 4544 8e21 5846  ....$..s.GED.!XF
	0x0020:  7012 faf0 2990 0000 0204 05b4 0103 0307  p...)...........
00:21:59.633985 IP 192.168.1.3.63347 > bacon.git: Flags [.], ack 1, win 1023, length 0
	0x0000:  4500 0028 0000 0000 2606 117b c0a8 0103  E..(....&..{....
	0x0010:  c0a8 0102 f773 24ca 8e21 5846 9447 4545  .....s$..!XF.GEE
	0x0020:  5010 03ff 4c4d 0000                      P...LM..
00:22:04.842008 ARP, Request who-has 192.168.1.3 tell bacon, length 28
	0x0000:  0001 0800 0604 0001 ba15 5a0d dd6e c0a8  ..........Z..n..
	0x0010:  0102 0000 0000 0000 c0a8 0103            ............
00:22:04.842277 ARP, Reply 192.168.1.3 is-at 16:9b:7c:c9:36:72 (oui Unknown), length 28
	0x0000:  0001 0800 0604 0002 169b 7cc9 3672 c0a8  ..........|.6r..
	0x0010:  0103 ba15 5a0d dd6e c0a8 0102            ....Z..n....
00:22:51.398007 IP bacon.mdns > 224.0.0.251.mdns: 0 [2q] PTR (QM)? _ipps._tcp.local. PTR (QM)? _ipp._tcp.local. (45)
	0x0000:  4500 0049 3220 4000 ff11 a6dd c0a8 0102  E..I2.@.........
	0x0010:  e000 00fb 14e9 14e9 0035 3191 0000 0000  .........51.....
	0x0020:  0002 0000 0000 0000 055f 6970 7073 045f  ........._ipps._
	0x0030:  7463 7005 6c6f 6361 6c00 000c 0001 045f  tcp.local......_
	0x0040:  6970 70c0 1200 0c00 01                   ipp......
00:24:59.490469 IP bacon.mdns > 224.0.0.251.mdns: 0 [2q] PTR (QM)? _ipps._tcp.local. PTR (QM)? _ipp._tcp.local. (45)
	0x0000:  4500 0049 6d9c 4000 ff11 6b61 c0a8 0102  E..Im.@...ka....
	0x0010:  e000 00fb 14e9 14e9 0035 3191 0000 0000  .........51.....
	0x0020:  0002 0000 0000 0000 055f 6970 7073 045f  ........._ipps._
	0x0030:  7463 7005 6c6f 6361 6c00 000c 0001 045f  tcp.local......_
	0x0040:  6970 70c0 1200 0c00 01                   ipp......
00:26:46.535033 IP6 bacon.mdns > ff02::fb.mdns: 0 [2q] PTR (QM)? _ipps._tcp.local. PTR (QM)? _ipp._tcp.local. (45)
	0x0000:  600a cdc6 0035 11ff fe80 0000 0000 0000  `....5..........
	0x0010:  b815 5aff fe0d dd6e ff02 0000 0000 0000  ..Z....n........
	0x0020:  0000 0000 0000 00fb 14e9 14e9 0035 e726  .............5.&
	0x0030:  0000 0000 0002 0000 0000 0000 055f 6970  ............._ip
	0x0040:  7073 045f 7463 7005 6c6f 6361 6c00 000c  ps._tcp.local...
	0x0050:  0001 045f 6970 70c0 1200 0c00 01         ..._ipp......
```

I will try to figure out tomorrow what is going on. At least, this is my outcome :+1:.

**Comment by dinosaure** [comment]
Deeper on the stack, it seems that the `write` does not really write (and `git` expects something to start to talk). From logs, I can have this situation at the beginning:
```
2021-11-26 14:17:43 +01:00: DBG [tcp.timer] fast_timer (timer:1107086791ns, connections:1)
2021-11-26 14:17:43 +01:00: DBG [tcp.timer] fast_timer (timer:1307896607ns, connections:1)
2021-11-26 14:17:43 +01:00: DBG [tcp.timer] slow_timer (timer:1408361638ns, connections:1)
2021-11-26 14:17:43 +01:00: DBG [tcp.timer] connection:192.168.1.3:10936 -> 192.168.1.2:9418, tt_rexmt:None, tt_2msl:None, tt_conn_est:None, tt_fin_wait_2:None.
```

where it seems that we reach the [last branch][] of the _slow timer_ which does... nothing.

[last branch]: https://github.com/roburio/utcp/blob/a5c9464bb75d5c8b560554de1d6b149c6496e2e1/src/tcptimer.ml#L158

**Comment by dinosaure** [comment]
Further more, it seems that `utcp` considers the current connection into the IDLE state as explained in [this comment line][] - so the packet did not expired but this is the reason why we have only `None` values.

[this comment line]: https://github.com/roburio/utcp/blob/a5c9464bb75d5c8b560554de1d6b149c6496e2e1/src/state.ml#L65

**Comment by hannesm** [comment]
Interesting, thanks for looking into this. There is a similar issue with passive close (where close does nothing, and noone ever sends a FIN or pushes the connection out of close_wait). TL;DR: I think I'm missing something in respect to the user.ml -- since the spec doesn't do more in e.g. `close_2`, but a concrete stack (e.g. the FreeBSD one) moves further to `Last_ack`. This means I'm pretty sure the deliver_in are fine, but on the output edge sending segments is not triggered soon enough.

A write should fill the `sndq` and the timer should output the data (I think) -- also this comment in user.ml:
```OCaml
(* it occurs that all these functions below are not well suited for sending out
   segments, a tcp_output(_really) will for sure help *)

(* or should only a timer be responsible for outputting data? sounds a bit weird *)
```

eventually, sprinkling some `tcp_output_perhaps` may solve the issue.

**Comment by dinosaure** [comment]
And another log is about the `fast_timer` which considers that `tt_delack` expired:
```
[      1113521460][DEBUG][tcp.timer]: fast_timer (timer:1113517943ns, connections:1)
[      1113560785][DEBUG][tcp.timer]: connection: 192.168.1.3:41045 -> 192.168.1.2:9418, tt_delack:expired none.
```

**Comment by dinosaure** [comment]
So I did this patch on `src/tcptimer.ml`:
```diff
-          | None, None, None, None -> Some conn, None
+          | None, None, None, None ->
+            Log.debug (fun m -> m "None, None, None, None") ;
+            let conn, out = Segment.tcp_output_perhaps now id conn in
+            Some conn, out
```

And it does not fix the initial issue, nothing is writing.

**Comment by dinosaure** [comment]
So I reach the point where we want to write something but we write 0 byte:
```
[      1003008201][DEBUG][smart_flow]: Write 53 byte(s).
[      1003041039][DEBUG][smart_flow]: Start to read 65536 byte(s).
[      1011891277][DEBUG][happy-eyeballs]: timer
[      1011940885][DEBUG][happy-eyeballs]: timer 0 actions
[      1101589568][DEBUG][tcp.timer]: fast_timer (timer:1101585695ns, connections:1)
[      1101637325][DEBUG][tcp.timer]: connection: 192.168.1.3:23682 -> 192.168.1.2:9418, tt_delack:expired none.
[      1302953647][DEBUG][tcp.timer]: fast_timer (timer:1302946571ns, connections:1)
[      1303063554][DEBUG][tcp.timer]: connection: 192.168.1.3:23682 -> 192.168.1.2:9418, tt_delack:expired none.
[      1403076045][DEBUG][tcp.timer]: slow_timer (timer:1403072687ns, connections:1)
[      1403129694][DEBUG][tcp.timer]: connection:192.168.1.3:23682 -> 192.168.1.2:9418, tt_rexmt:expired idle, tt_2msl:expired none, tt_conn_est:expired, tt_fin_wait_2:expired.
[      1403149575][DEBUG][tcp.timer]: tcp_output_perhaps
[      1403160392][DEBUG][tcp.timer]: out: Some
                                             (src:192.168.1.3 ->
                                              dst:192.168.1.2, 
                                              seq 1728113140 ack 4350690
                                              window 4096
                                              opts , 0 bytes data)
```

**Comment by dinosaure** [comment]
I think the error is about the `snd_wnd_unused` which is equal to `0` in my case. Then, `tcp_output_perhaps` just say to send 0 byte due to this value (when we apply a `min` with `cb.State.t_maxseq`. See this line:
https://github.com/roburio/utcp/blob/a5c9464bb75d5c8b560554de1d6b149c6496e2e1/src/segment.ml#L359-L361

Still on the same the context, I have this log output:
```
[      1405176655][DEBUG][tcp.segment]: tcp_output_perhaps: do output? true
[      1405183295][DEBUG][tcp.segment]: length of the send queue: 53.
[      1405188648][DEBUG][tcp.segment]: shift the send queue to 0 byte(s).
[      1405194147][DEBUG][tcp.segment]: min length:53 (min (max 0 snd_wnd_unused:0) t_maxseg:1460)
```

**Comment by dinosaure** [comment]
Good news, if I apply this patch:
```diff
+  let max_seg = match max 0 snd_wnd_unused with
+    | 0 -> cb.State.t_maxseg
+    | snd_wnd_unused -> min snd_wnd_unused cb.State.t_maxseg in
   let data_to_send =
-    Cstruct.sub data' 0 (min (Cstruct.length data') (min (max 0 snd_wnd_unused) cb.State.t_maxseg))
+    Cstruct.sub data' 0 (min (Cstruct.length data') max_seg)
   in
```

with the other one, I can communicate 🎉 ! But I get a final error:
```
[      2715976741][DEBUG][smart_flow]: Start to read 64172 byte(s).
[      2715988072][DEBUG][git-cstruct-append]: Append on [false] + 1171455 byte(s).
[      2716003274][INFO][tcp.input]: 192.168.1.3:54382 -> 192.168.1.2:9418 TCP FP
seq 4129110578 ack 4055181444 window 501
opts , 105 bytes data
[      2716016109][DEBUG][tcp.input]: 192.168.1.3:54382 -> 192.168.1.2:9418 handle_conn TCP established cb needfin false
shouldacknow false snd_una 4055181444 snd_max 4055181444 snd_nxt 4055181444
snd_wl1 4127930415 snd_wl2 4055181444 iss 4055181199 snd_wnd 64128
snd_cwnd 8760 snd_sshtresh 1073725440 rcv_wnd 259224 tf_rxwin0sent false
rcv_nxt 4129110578 irs 4127929918 rcv_adv 4129369802 snd_recover 0
t_maxseg 1460 t_advmss 1460 snd_scale 7 rcv_scale 6 request_r_scale 6
tf_doing_ws true seg FP seq 4129110578 ack 4055181444 window 501
opts , 105 bytes data
[      2716041218][DEBUG][tcp.segment]: tcp_output_perhaps: do output? true
[      2716045633][DEBUG][tcp.segment]: length of the send queue: 0.
[      2716052925][DEBUG][tcp.segment]: shift the send queue to 0 byte(s).
[      2716057209][DEBUG][tcp.segment]: min length:0 (min (max 0 snd_wnd_unused:8760) t_maxseg:1460)
[      2716062038][DEBUG][tcp.segment]: data to send: 
[      2716069271][DEBUG][tcp.input]: 192.168.1.3:54382 -> 192.168.1.2:9418 now TCP close wait cb needfin false
shouldacknow false snd_una 4055181444 snd_max 4055181444 snd_nxt 4055181444
snd_wl1 4129110578 snd_wl2 4055181444 iss 4055181199 snd_wnd 64128
snd_cwnd 8760 snd_sshtresh 1073725440 rcv_wnd 262039 tf_rxwin0sent false
rcv_nxt 4129110684 irs 4127929918 rcv_adv 4129372723 snd_recover 0
t_maxseg 1460 t_advmss 1460 snd_scale 7 rcv_scale 6 request_r_scale 6
tf_doing_ws true
[      2716088275][INFO][tcp.input]: answer  seq 4055181444 ack 4129110684
window 4094
opts , 0 bytes data
[      2716097184][DEBUG][ipv4]: ip write: mtu is 1500, hdr_len is 20, size 0 payload len 20, needed_bytes 40
[      2716140550][ERROR][tcp.mirage]: error while read cant recv, EOF
[      2716153205][ERROR][smart_flow]: Got an error: connection attempt was refused.
[      2716159316][DEBUG][git-fetch]: End of pack.
```

Not sure however that it's the right fix.

**Comment by dinosaure** [comment]
So I tried to understand why the connection fails and it seems that in any situation, `utcp` says:
```
[      2999386953][ERROR][tcp.input]: dropping segment in established failed condition in_window
```

Which corresponds to:
https://github.com/roburio/utcp/blob/a5c9464bb75d5c8b560554de1d6b149c6496e2e1/src/input.ml#L1039

I will try to go further and understand why this situation appear.

**Comment by hannesm** [comment]
Thanks for your detailed report, unfortunately I won't be able to look deeper into that at the moment, but hopefully at some point in December.

It is likely a good idea to be more specific in the log message if a constraint was violated (the `in_window`) to more easily figure out where the failure was and if eventually the condition is wrong (or the control block was updated too eagerly / badly).

**Comment by hannesm** [comment]
It was a bit later then December 2021, but finally I managed to look into this issue a bit more.

An initial issue was `deliver_in_2` (the completion of a TCP handshake, client side -- i.e. SYN was sent, SYN/ACK received) -- which did not set the snd_wnd. This addresses https://github.com/roburio/utcp/issues/16#issuecomment-980069264

But there's -- as you encountered -- some more things to do, i.e. User.send to call Segment.tcp_output_perhaps (I have some local work that I'm not yet confident enough to push); but then also the segment reassembly etc. -- I'll take in the following days some further looks (but likely will first use a simpler unikernel which only establishes a short TCP connection (such as a DNS request, and DNS-over-TLS)), and will come back to your git clone thereafter.

FWIW, currently used branches (for a mirage 4 experience):
- ocaml-git from https://github.com/hannesm/ocaml-git/tree/simple-store-utcp
- mirage from https://github.com/hannesm/mirage/tree/mirage44-my-tcp

**Comment by hannesm** [comment]
with [b260c81](https://github.com/roburio/utcp/commit/b260c81351cc023e3768c156304ab952966d7df4), further issues are solved, namely:
`There is a similar issue with passive close (where close does nothing, and noone ever sends a FIN or pushes the connection out of close_wait). TL;DR: I think I'm missing something in respect to the user.ml` (from above): exactly "eventually, sprinkling some `tcp_output_perhaps` may solve the issue." has been done in user.ml

The other mentioned commit above solves the "I think the error is about the `snd_wnd_unused` which is equal to 0 in my case.".

With that patch, I can successfully run a DNS-over-TLS client request (+getting response) and do a clean TCP shutdown (the server issues a FIN after some seconds).

There are still issues, though:
- the TLS close notify is lost in the meantime (the server sends the close notify and then a FIN, where utcp decides to drop the rcvq entirely, thus the close notify is never read by the tls layer)
- the in_window issue (and in general, a TCP session with lots of data due to missing segment assembly)

**Comment by hannesm** [comment]
with segment reassembly in the stack (2e27f334848291938adc215809221dbf655fe8da) and the other fixes (initial window, recv returning rcvq if present - e67d0f5b2fea391fbb8e9d15d9445eda0ce0993b), a git clone now succeeds in all cases.

Thanks for the report, sorry that the fixes took so long.
